{
  "contract_version": "decision-proposal/v0",
  "proposal_id": "DP-0001",
  "run_ref": "CR-20260711T030100Z-9f8e7d6c",
  "target": {
    "type": "task",
    "id": "T-0001"
  },
  "question": "既存セッションのtenant_idが一意に決まらない行を、移行時にどう扱うか。",
  "why_human_required": "技術だけで正解が決まらず、可用性・強制ログアウト・データ分離リスクの優先順位が製品判断だから。",
  "impact_scope": "DB移行、ログイン継続性、ロールバック、顧客影響、監査記録。",
  "candidates": [
    {
      "candidate_id": "OPT-A",
      "title": "判定不能セッションを失効させる",
      "summary": "移行時に所有者が一意でないセッションだけを無効化し、再ログインさせる。",
      "benefits": [
        "テナント越境リスクを最小化",
        "移行規則が明確"
      ],
      "costs": [
        "一部利用者が再ログインを要求される"
      ],
      "risks": [
        "対象件数の見積もりが誤るとサポート負荷が増える"
      ],
      "assumptions": [
        "再ログインが許容される"
      ],
      "evidence_refs": [
        "C-002",
        "VP-002"
      ],
      "uncertainty": "medium",
      "reversibility": "moderate",
      "reconsider_when": [
        "判定不能行が全体の0.1%を超える"
      ]
    },
    {
      "candidate_id": "OPT-B",
      "title": "互換モードで遅延移行する",
      "summary": "判定不能行を旧経路へ残し、次回ログイン時にtenant_idを確定する。",
      "benefits": [
        "強制ログアウトを減らせる"
      ],
      "costs": [
        "二重経路の実装と運用が必要"
      ],
      "risks": [
        "互換モードが長期化し、境界ロジックが複雑になる"
      ],
      "assumptions": [
        "旧経路を安全に隔離できる"
      ],
      "evidence_refs": [
        "C-001",
        "C-002"
      ],
      "uncertainty": "high",
      "reversibility": "hard",
      "reconsider_when": [
        "強制ログアウトが契約上許容されない"
      ]
    }
  ],
  "recommended_candidate_id": "OPT-A",
  "recommendation_reason": "認証境界では可用性よりデータ分離を優先し、複雑な暫定経路を残さない方が残存リスクを説明しやすい。",
  "unanswered_behavior": "block",
  "unresolved_assumptions": [
    "判定不能セッション件数",
    "再ログインによる業務影響"
  ],
  "minority_opinions": [
    {
      "participant_ids": [
        "P-01"
      ],
      "candidate_id": "OPT-B",
      "argument": "大口顧客の長時間セッションが多い場合、段階移行の方が事業影響を抑えられる。",
      "evidence_refs": [
        "VP-002"
      ]
    }
  ],
  "generated_by": {
    "run_ref": "CR-20260711T030100Z-9f8e7d6c",
    "participant_ids": [
      "P-01",
      "P-02",
      "P-03"
    ]
  }
}
